Timestamp,Event
2025-10-20 11:37:51,User Luiza logon successful at 2025-10-20 11:37:51
2025-10-20 23:30:59,User Natalia logon successful from IP 192.168.210.229 at 2025-10-20 23:30:59
2025-10-15 06:55:14,User Miguel logon successful at 2025-10-15 06:55:14
2025-10-14 05:07:32,User Pedro logon successful at 2025-10-14 05:07:32
2025-10-11 00:13:53,User João logon successful at 2025-10-11 00:13:53
2025-10-16 19:03:51,User Pedro logon successful from IP 192.168.54.55 at 2025-10-16 19:03:51
2025-10-16 16:42:47,User Carol logon successful from IP 192.168.110.252 at 2025-10-16 16:42:47
2025-10-16 12:12:15,User Carlos logon successful from IP 14.42.31.37 at 2025-10-16 12:12:15
2025-10-18 15:24:56,User João logon successful from IP 192.168.103.106 at 2025-10-18 15:24:56
2025-10-10 03:17:20,User Thais logon successful from IP 192.168.232.236 at 2025-10-10 03:17:20
2025-10-15 03:37:51,User Thais logon successful at 2025-10-15 03:37:51
2025-10-11 20:39:54,User Maria logon successful at 2025-10-11 20:39:54
